[
  {
    "request_id": "SYN-REQ-2026-00001",
    "is_synthetic": true,
    "request_type": "data_request",
    "platform": "Instagram",
    "category": "CSAM",
    "priority": "urgent",
    "sent_at": "2026-09-05T23:24:55+00:00",
    "acknowledged_at": "2026-09-06T00:01:41.580805+00:00",
    "claimed_removal_at": null,
    "data_provided_at": "2026-09-07T19:37:24.222723+00:00",
    "police_unit_id": "SYN-UNIT-KL-CYBER-04",
    "is_complete_request": true,
    "incompletion_reason": null,
    "status": "data_provided",
    "rejection_reason": null,
    "content_url_hash": "cfcbf8712b063919cc4ec903ad43efcd873f02dd44ae72661f46bbaa6ca84c95"
  },
  {
    "request_id": "SYN-REQ-2026-00002",
    "is_synthetic": true,
    "request_type": "takedown",
    "platform": "X_Twitter",
    "category": "Other",
    "priority": "routine",
    "sent_at": "2026-09-01T07:34:17+00:00",
    "acknowledged_at": "2026-09-01T10:09:53.329817+00:00",
    "claimed_removal_at": "2026-09-01T12:56:16.787324+00:00",
    "data_provided_at": null,
    "police_unit_id": "SYN-UNIT-KL-CYBER-08",
    "is_complete_request": true,
    "incompletion_reason": null,
    "status": "claimed_removed",
    "rejection_reason": null,
    "content_url_hash": "d10f43092c292f20361e9f64657d670c87ebc8695aa1e7ad74c2dc6b18a9ebd1"
  },
  {
    "request_id": "SYN-REQ-2026-00003",
    "is_synthetic": true,
    "request_type": "takedown",
    "platform": "Instagram",
    "category": "NonConsensualImagery",
    "priority": "routine",
    "sent_at": "2026-09-30T07:23:30+00:00",
    "acknowledged_at": "2026-09-30T10:12:08.184444+00:00",
    "claimed_removal_at": "2026-09-30T15:35:19.790378+00:00",
    "data_provided_at": null,
    "police_unit_id": "SYN-UNIT-KL-CYBER-06",
    "is_complete_request": true,
    "incompletion_reason": null,
    "status": "claimed_removed",
    "rejection_reason": null,
    "content_url_hash": "b3cd7ae032087834d91cad3bd56c8b9c3717f825d18170110a1a6c30e91e6cde"
  },
  {
    "request_id": "SYN-REQ-2026-00004",
    "is_synthetic": true,
    "request_type": "takedown",
    "platform": "Reddit",
    "category": "Terrorism",
    "priority": "urgent",
    "sent_at": "2026-09-15T01:09:41+00:00",
    "acknowledged_at": "2026-09-15T06:22:25.113082+00:00",
    "claimed_removal_at": "2026-09-15T09:23:59.475842+00:00",
    "data_provided_at": null,
    "police_unit_id": "SYN-UNIT-KL-CYBER-01",
    "is_complete_request": true,
    "incompletion_reason": null,
    "status": "claimed_removed",
    "rejection_reason": null,
    "content_url_hash": "c637e4ebb412fe8d86aaf35cbaf0aa94253163db10130f035377ba9b10e2c5f8"
  },
  {
    "request_id": "SYN-REQ-2026-00005",
    "is_synthetic": true,
    "request_type": "takedown",
    "platform": "YouTube",
    "category": "Defamation",
    "priority": "routine",
    "sent_at": "2026-09-04T11:11:23+00:00",
    "acknowledged_at": "2026-09-04T15:35:29.653188+00:00",
    "claimed_removal_at": "2026-09-05T00:18:11.046155+00:00",
    "data_provided_at": null,
    "police_unit_id": "SYN-UNIT-KL-CYBER-05",
    "is_complete_request": true,
    "incompletion_reason": null,
    "status": "claimed_removed",
    "rejection_reason": null,
    "content_url_hash": "1ebf7bd185230ee4ddb14aed066ed47762de549740c07e0b3e9514f0804aa4ad"
  },
  {
    "request_id": "SYN-REQ-2026-00006",
    "is_synthetic": true,
    "request_type": "takedown",
    "platform": "Reddit",
    "category": "CSAM",
    "priority": "routine",
    "sent_at": "2026-09-20T11:23:27+00:00",
    "acknowledged_at": "2026-09-20T17:03:14.402332+00:00",
    "claimed_removal_at": null,
    "data_provided_at": null,
    "police_unit_id": "SYN-UNIT-KL-CYBER-01",
    "is_complete_request": true,
    "incompletion_reason": null,
    "status": "acknowledged",
    "rejection_reason": null,
    "content_url_hash": "3acfc680fcacde094029d1bc87a66804fa3fa904a1a4dacf047b4790c15de8ae"
  },
  {
    "request_id": "SYN-REQ-2026-00007",
    "is_synthetic": true,
    "request_type": "takedown",
    "platform": "Reddit",
    "category": "Terrorism",
    "priority": "urgent",
    "sent_at": "2026-09-23T06:36:04+00:00",
    "acknowledged_at": "2026-09-23T11:05:47.565980+00:00",
    "claimed_removal_at": "2026-09-23T23:45:49.518340+00:00",
    "data_provided_at": null,
    "police_unit_id": "SYN-UNIT-KL-CYBER-07",
    "is_complete_request": true,
    "incompletion_reason": null,
    "status": "claimed_removed",
    "rejection_reason": null,
    "content_url_hash": "da643190e739aef86b25b56b56b921deb7339b5a30fdc05be414e0a7d933b3bc"
  },
  {
    "request_id": "SYN-REQ-2026-00008",
    "is_synthetic": true,
    "request_type": "takedown",
    "platform": "Other",
    "category": "Impersonation",
    "priority": "routine",
    "sent_at": "2026-09-05T09:55:01+00:00",
    "acknowledged_at": "2026-09-05T10:55:07.349623+00:00",
    "claimed_removal_at": "2026-09-08T11:48:33.856685+00:00",
    "data_provided_at": null,
    "police_unit_id": "SYN-UNIT-KL-CYBER-03",
    "is_complete_request": true,
    "incompletion_reason": null,
    "status": "claimed_removed",
    "rejection_reason": null,
    "content_url_hash": "d229f65e8412ae2f8ae725c35c45c9578a6bb6876e860664837380aa3db7a03f"
  },
  {
    "request_id": "SYN-REQ-2026-00009",
    "is_synthetic": true,
    "request_type": "takedown",
    "platform": "WhatsApp",
    "category": "Impersonation",
    "priority": "routine",
    "sent_at": "2026-09-27T20:33:17+00:00",
    "acknowledged_at": "2026-09-28T00:54:25.131443+00:00",
    "claimed_removal_at": "2026-09-28T17:48:11.584318+00:00",
    "data_provided_at": null,
    "police_unit_id": "SYN-UNIT-KL-CYBER-08",
    "is_complete_request": true,
    "incompletion_reason": null,
    "status": "claimed_removed",
    "rejection_reason": null,
    "content_url_hash": "7a08be1a347370efda5a9a6e82cda82e247a375f4d52758cc3ceab6167a8bca6"
  },
  {
    "request_id": "SYN-REQ-2026-00010",
    "is_synthetic": true,
    "request_type": "takedown",
    "platform": "Reddit",
    "category": "NonConsensualImagery",
    "priority": "routine",
    "sent_at": "2026-09-13T18:52:13+00:00",
    "acknowledged_at": "2026-09-13T21:57:56.158769+00:00",
    "claimed_removal_at": "2026-09-15T20:33:05.251496+00:00",
    "data_provided_at": null,
    "police_unit_id": "SYN-UNIT-KL-CYBER-03",
    "is_complete_request": true,
    "incompletion_reason": null,
    "status": "claimed_removed",
    "rejection_reason": null,
    "content_url_hash": "8d28af633087751844f6e0fac55fcac7893cfc6f9104d8daa65c215289247337"
  },
  {
    "request_id": "SYN-REQ-2026-00011",
    "is_synthetic": true,
    "request_type": "takedown",
    "platform": "TikTok",
    "category": "Terrorism",
    "priority": "routine",
    "sent_at": "2026-09-26T17:54:24+00:00",
    "acknowledged_at": "2026-09-26T20:53:21.985239+00:00",
    "claimed_removal_at": "2026-09-27T10:52:02.258238+00:00",
    "data_provided_at": null,
    "police_unit_id": "SYN-UNIT-KL-CYBER-03",
    "is_complete_request": true,
    "incompletion_reason": null,
    "status": "claimed_removed",
    "rejection_reason": null,
    "content_url_hash": "db09cc084a332e0ef4662fbd80648cc106dd54ecfdbd7fc18f36652580730213"
  },
  {
    "request_id": "SYN-REQ-2026-00012",
    "is_synthetic": true,
    "request_type": "takedown",
    "platform": "X_Twitter",
    "category": "NonConsensualImagery",
    "priority": "routine",
    "sent_at": "2026-09-26T20:38:51+00:00",
    "acknowledged_at": "2026-09-26T23:33:05.997711+00:00",
    "claimed_removal_at": "2026-09-27T21:08:24.425994+00:00",
    "data_provided_at": null,
    "police_unit_id": "SYN-UNIT-KL-CYBER-08",
    "is_complete_request": true,
    "incompletion_reason": null,
    "status": "claimed_removed",
    "rejection_reason": null,
    "content_url_hash": "b1c7a7f29f0dffe241084c98b16d6d29a0e69c690f7294370779961079fef42e"
  },
  {
    "request_id": "SYN-REQ-2026-00013",
    "is_synthetic": true,
    "request_type": "takedown",
    "platform": "TikTok",
    "category": "Terrorism",
    "priority": "urgent",
    "sent_at": "2026-09-19T03:03:59+00:00",
    "acknowledged_at": "2026-09-19T03:52:49.129120+00:00",
    "claimed_removal_at": "2026-09-19T07:20:54.023375+00:00",
    "data_provided_at": null,
    "police_unit_id": "SYN-UNIT-KL-CYBER-07",
    "is_complete_request": true,
    "incompletion_reason": null,
    "status": "claimed_removed",
    "rejection_reason": null,
    "content_url_hash": "3e5c184b1502626d9b17af1d7028c2931521f1a14416d68d34b25b676662ed1f"
  },
  {
    "request_id": "SYN-REQ-2026-00014",
    "is_synthetic": true,
    "request_type": "data_request",
    "platform": "X_Twitter",
    "category": "Terrorism",
    "priority": "routine",
    "sent_at": "2026-09-02T12:35:55+00:00",
    "acknowledged_at": "2026-09-02T14:06:10.218434+00:00",
    "claimed_removal_at": null,
    "data_provided_at": "2026-09-04T15:51:49.867093+00:00",
    "police_unit_id": "SYN-UNIT-KL-CYBER-01",
    "is_complete_request": true,
    "incompletion_reason": null,
    "status": "data_provided",
    "rejection_reason": null,
    "content_url_hash": "fe78949565233a56f87dbcf3f910550ca453fa5721d787d19a950f85587d3d07"
  },
  {
    "request_id": "SYN-REQ-2026-00015",
    "is_synthetic": true,
    "request_type": "takedown",
    "platform": "Other",
    "category": "ViolenceIncitement",
    "priority": "routine",
    "sent_at": "2026-09-10T05:50:37+00:00",
    "acknowledged_at": "2026-09-10T08:02:02.280314+00:00",
    "claimed_removal_at": "2026-09-13T06:22:54.466057+00:00",
    "data_provided_at": null,
    "police_unit_id": "SYN-UNIT-KL-CYBER-08",
    "is_complete_request": true,
    "incompletion_reason": null,
    "status": "claimed_removed",
    "rejection_reason": null,
    "content_url_hash": "b04b6b49afcb6f7fd1d54a0ab229bd3054e6e506392eecce034c122428e3b9f2"
  },
  {
    "request_id": "SYN-REQ-2026-00016",
    "is_synthetic": true,
    "request_type": "data_request",
    "platform": "Meta",
    "category": "Impersonation",
    "priority": "urgent",